{
  "$schema": "http://json-schema.org/draft-07/schema#",
  "$id": "urn:pulso:v3:evidence:1",
  "title": "Pulso evidence",
  "type": "object",
  "additionalProperties": false,
  "properties": {
    "id": {
      "type": "string",
      "pattern": "^[A-Za-z0-9][A-Za-z0-9_-]{0,79}$"
    },
    "kind": {
      "enum": [
        "executed",
        "manual",
        "static",
        "not_run"
      ]
    },
    "status": {
      "enum": [
        "pass",
        "fail",
        "blocked",
        "not_run"
      ]
    },
    "checkedAt": {
      "type": "string",
      "format": "date-time"
    },
    "criterionIds": {
      "type": "array",
      "items": {
        "type": "string",
        "pattern": "^[A-Za-z0-9][A-Za-z0-9_-]{0,79}$"
      },
      "minItems": 0
    },
    "taskIds": {
      "type": "array",
      "items": {
        "type": "string",
        "pattern": "^[A-Za-z0-9][A-Za-z0-9_-]{0,79}$"
      },
      "minItems": 0
    },
    "report": {
      "type": "string",
      "minLength": 1,
      "pattern": "^(?!/)(?!.*\\\\)(?!.*(?:^|/)\\.\\.(?:/|$))(?![A-Za-z]:)[^\\u0000]+$"
    },
    "command": {
      "description": "Comando de la comprobación, no del cálculo de huellas. Para una revisión estática sin comando usa null.",
      "anyOf": [
        {
          "type": "string",
          "minLength": 1
        },
        {
          "type": "null"
        }
      ]
    },
    "cwd": {
      "type": "string",
      "minLength": 1,
      "pattern": "^(?!/)(?!.*\\\\)(?!.*(?:^|/)\\.\\.(?:/|$))(?![A-Za-z]:)[^\\u0000]+$"
    },
    "exitCode": {
      "description": "Solo executed admite un exit code numérico. static, manual y not_run requieren null; executed con status pass requiere 0.",
      "anyOf": [
        {
          "type": "integer"
        },
        {
          "type": "null"
        }
      ]
    },
    "basis": {
      "type": "string",
      "minLength": 1
    },
    "files": {
      "type": "array",
      "items": {
        "anyOf": [
          {
            "type": "object",
            "additionalProperties": false,
            "properties": {
              "path": {
                "type": "string",
                "minLength": 1,
                "pattern": "^(?!/)(?!.*\\\\)(?!.*(?:^|/)\\.\\.(?:/|$))(?![A-Za-z]:)[^\\u0000]+$"
              },
              "sha256": {
                "type": "string",
                "pattern": "^[a-f0-9]{64}$"
              }
            },
            "required": [
              "path",
              "sha256"
            ]
          },
          {
            "type": "object",
            "additionalProperties": false,
            "properties": {
              "path": {
                "type": "string",
                "minLength": 1,
                "pattern": "^(?!/)(?!.*\\\\)(?!.*(?:^|/)\\.\\.(?:/|$))(?![A-Za-z]:)[^\\u0000]+$"
              },
              "absent": {
                "const": true
              }
            },
            "required": [
              "path",
              "absent"
            ]
          }
        ]
      },
      "minItems": 1
    },
    "summary": {
      "type": "string",
      "minLength": 1
    },
    "editedAt": {
      "type": "string",
      "format": "date-time"
    },
    "acceptanceBasis": {
      "type": "object",
      "additionalProperties": false,
      "properties": {
        "criteria": {
          "type": "array",
          "items": {
            "type": "object",
            "additionalProperties": false,
            "properties": {
              "id": {
                "type": "string",
                "pattern": "^[A-Za-z0-9][A-Za-z0-9_-]{0,79}$"
              },
              "sha256": {
                "type": "string",
                "pattern": "^[a-f0-9]{64}$"
              }
            },
            "required": [
              "id",
              "sha256"
            ]
          },
          "minItems": 0,
          "maxItems": 50
        },
        "tasks": {
          "type": "array",
          "items": {
            "type": "object",
            "additionalProperties": false,
            "properties": {
              "id": {
                "type": "string",
                "pattern": "^[A-Za-z0-9][A-Za-z0-9_-]{0,79}$"
              },
              "sha256": {
                "type": "string",
                "pattern": "^[a-f0-9]{64}$"
              }
            },
            "required": [
              "id",
              "sha256"
            ]
          },
          "minItems": 0,
          "maxItems": 50
        }
      },
      "required": [
        "criteria",
        "tasks"
      ]
    }
  },
  "required": [
    "id",
    "kind",
    "status",
    "checkedAt",
    "criterionIds",
    "taskIds",
    "report",
    "command",
    "cwd",
    "exitCode",
    "basis",
    "files",
    "summary"
  ]
}
